sentence,correct_phonemes,incorrect_phonemes,incorrect_phonemes_list,per,has_loanword,duration_seconds,total_expected_phonemes,total_recognized_phonemes
Unsere bisherigen Betrachtungen waren stationär.,28,13,"ɐ→ə, +r, +h, ɐ→eː, +r, aː→ɑː, +r, ɐ→ə, ɑː→a, t→ts, s→j, o→oː, ɛ→eː",0.35135135135135137,False,3.5703125,37,41
Cool bleiben lautet die Devise.,19,4,"+k, -a, o→aʊ, i→iː",0.18181818181818182,True,2.509765625,22,22
Wie groß ist der Anteil an Ackerfläche?,22,6,"ɾ→r, eː→ɛ, ɐ→ɾ, -ɛ, ɾ→ɜ, ç→ʃ",0.21428571428571427,False,2.830078125,28,27
Die Anzeichen für einen Infarkt sind je nach Geschlecht unterschiedlich.,36,16,"t→ts, -s, +ə, n̩→n, -ɐ, a→ɾ, e→aɪ, ɪ→ɛ, f→t, a→f, ɾ→ɑː, +j, ː→eː, aː→a, +ɜ, ɐ→ɾ",0.32653061224489793,False,4.671875,49,50
"Bei der Berufsausbildung haben wir im Rahmen des Ausbildungspaktes gestiegenen Wert darauf gelegt, dass auch Menschen mit Behinderungen an der Berufsausbildung teilnehmen können.",107,35,"-b, eː→ɛ, ɐ→ɾ, ɾ→r, ʊ→uː, z→s, -a, o→aʊ, +k, aː→ɑː, ɐ→ɾ, ʁ→r, aː→ɑː, ə→ɛ, +eː, ɾ→r, -a, o→aʊ, ɛ→eː, -z, ç→ʃ, ɐ→ə, +r, eː→ɛ, ɐ→ɾ, ɾ→r, ʊ→uː, z→s, -a, o→aʊ, t→k, a→t, e→aɪ, e→eː, œ→ə",0.2517985611510791,False,11.1875,139,137
In zehn Jahren wird niemand mehr über dieses Internet sprechen!,31,17,"-t, s→ts, ɑ→ɑː, ɾ→r, ʁ→ɾ, ɐ→ɾ, yː→y, ɐ→ɜ, i→iː, -ə, s→z, ɐ→ɛ, +ɾ, n→l, ʁ→ɾ, +ə, n̩→n",0.3695652173913043,True,3.98046875,46,46
Ich sage kein Sterbenswörtchen.,21,3,"aː→ɑː, ʁ→ɾ, ʁ→ɾ",0.125,False,2.0703125,24,24
Dafür kannst du auch Blumendraht oder sowas nehmen.,28,8,"a→ɑː, yː→uː, ʁ→ɾ, ː→uː, d→t, ʁ→r, aː→ɑː, ɐ→ɜ",0.2222222222222222,False,3.66015625,36,36
"Einerseits ist die Situation vorerst bereinigt, andererseits bleibt die Möglichkeit des Gegenangriffs aus.",52,36,"-a, e→aɪ, -ɛː, ɐ→ɜ, -a, e→aɪ, t→ts, tʰ→iː, ʊ→t, a→uː, t→w, +a, s→ts, ɐ→ɾ, ɛː→ɛ, ɐ→ɾ, ʃ→s, ɾ→r, -a, e→aɪ, eː→ə, ɾ→r, -ɛ, ɾ→ɜ, -a, -e, t→aɪ, -a, e→aɪ, øː→ø, ə→ɛ, ə→eː, ŋ→n, ɾ→ɡ, ɪ→r, f→ɪ",0.41379310344827586,False,6.890625,87,80
Eine Spinne war in den Rauchmelder gekrochen und hatte den Fehlalarm ausgelöst.,51,9,"-n, aː→ɑː, ɐ→ɾ, ʁ→r, ɐ→ɾ, ʁ→ɾ, -a, o→aʊ, œ→yː",0.15,False,4.828125,60,58
"Die, ähm, das Kapitel zwölf ist ja eine Hausaufgabe.",27,10,"eː→ɛ, ɪ→iː, l̩→ə, t→l, s→ts, œ→ə, +j, +ɑː, ː→ɾ, aː→ɑː",0.2857142857142857,False,5.03125,35,37
"Immer wieder verunglücken Touristen, weil sie die polsternde Wirkung von Heuballen überschätzen.",55,15,"ɐ→ɜ, ɐ→ɜ, ɛː→ɛ, ɐ→ɾ, +y, n→ŋ, -o, ɐ→r, ɛ→ə, -ɾ, yː→y, -ə, ʁ→ɜ, -t, s→ts",0.21739130434782608,False,5.890625,69,66
Der Ring ist eine Droge.,13,4,"eː→ɛ, ɐ→ɾ, ʀ→r, -ɾ",0.23529411764705882,True,1.900390625,17,16
Diese Fanpost ist nicht so berauschend.,21,10,"i→iː, -ə, s→z, a→ɛ, +ɾ, pʰ→p, ɾ→r, -a, o→aʊ, ɛ→ə",0.3333333333333333,False,2.58984375,30,29
"Wer zuletzt lacht, hat es als Letzter begriffen.",27,11,"-ɐ, t→ɾ, s→ts, t→s, s→t, eː→ɛ, t→s, s→t, t→ɜ, ɐ→ɾ, -f",0.2894736842105263,False,3.189453125,38,36
"Wieso dauert es schon wieder so lange, bis die Bude warm wird?",35,5,"ɐ→ɜ, eː→ɛ, ɐ→ɜ, ʁ→ɾ, ʁ→ɾ",0.125,False,3.939453125,40,40
Die größte Wüste der Welt ist die Eiswüste Antarktis.,33,8,"œ→ø, +uː, eː→ɛ, ɐ→ɾ, aj→aɪ, yː→uː, -ɾ, i→ə",0.2,False,4.390625,40,40
dunkles Schiefergrau,12,2,"ɐ→ə, ʁ→r",0.14285714285714285,False,2.48046875,14,14
Die Ausbreitung der Seuche allein sorgte für genug Gesprächsstoff.,36,14,"-d, -a, o→aʊ, ʁ→r, -ə, iː→aɪ, eː→ɛ, ɐ→ɾ, ɔ→oː, ɐ→ɾ, -ç, z→s, s→ʃ, -f",0.28,False,4.5,50,45
"Ja, das Lied habe ich auch schon lange nicht mehr gehört. Schön!",31,8,"+j, ː→ɑː, aː→ɑː, eː→ɛ, ɐ→ɾ, øː→œ, ɐ→ɾ, øː→ø",0.21052631578947367,False,3.849609375,38,39
Jetzt haben wir wieder so Schnulzen in unserem Repertoir.,30,17,"-t, aː→a, ɐ→ɾ, ɐ→ɛ, +ɾ, -t, s→ts, ɐ→ə, +r, ʁ→r, pʰ→p, +ɾ, ʁ→t, tʰ→w, ɔ→a, +ɑː, ɐ→ɾ",0.3953488372093023,False,3.890625,43,45
Letzte Woche hast du intensiv am Wiki mitgearbeitet.,35,7,"+t, ː→uː, ɪ→iː, cʰ→k, ɪ→iː, -ə, iː→aɪ",0.17073170731707318,False,3.390625,41,41
"Die ganze Frickelei kannst du dir sparen, wenn du es so machst wie ich.",35,13,"-t, s→ts, ʁ→ɾ, kʰ→ɡ, aj→aɪ, ː→uː, ɐ→ɾ, aː→ɑː, +r, ɐ→ə, +d, ː→uː, eː→ɛ",0.2826086956521739,False,5.26953125,46,47
"Ein defektes Windrad droht, einen seiner Flügel zu verlieren.",31,18,"-ɛ, ɪ→aɪ, ʁ→r, aː→ɑː, +r, o→oː, -a, e→aɪ, +ɜ, ɐ→ɾ, yː→uː, l̩→ə, t→l, s→ts, ɛː→ɛ, ɐ→ɾ, ɾ→r, e→ə",0.3829787234042553,False,3.91015625,47,47
Die Liquidität der Firma ist gefährdet.,22,10,"ɪ→iː, ɪ→iː, ɪ→iː, tʰ→t, eː→ɛ, eː→ɛ, ɐ→ɾ, ʁ→ɾ, a→ɑː, +t",0.3225806451612903,False,2.7109375,31,32
"Was wiederum als Verschleißteil zählt, ist Auslegungssache.",38,5,"e→ə, ɾ→r, u→ʊ, -t, s→ts",0.11627906976744186,False,4.01171875,43,42
"Das alles sind Probleme, die man ohne Nebenläufigkeit nicht hätte.",41,9,"ʀ→ɾ, o→oː, e→eː, ɛ→ə, -ɔ, ø→aʊ, -k, -ə, iː→aɪ",0.18,False,5.12890625,50,47
Ist die Uni nur ein Auffangbecken für Unentschlossene?,32,9,"uː→ʊ, i→iː, -ɐ, ɛ→ɾ, ɪ→aɪ, -a, o→aʊ, ɐ→ɾ, -z",0.21951219512195122,False,3.580078125,41,38
Ich verstehe die Frage nicht.,16,4,"ɛː→ɛ, ɐ→ɾ, ʀ→ɾ, aː→ɑː",0.2,False,2.01953125,20,20
So leicht lässt sich unsere Serverfarm nicht in die Knie zwingen.,36,11,"ɐ→ə, +r, z→s, ɛ→ɜ, ɐ→ɾ, -ɛ, ʁ→ɜ, a→ɑː, ʁ→ɾ, -t, s→ts",0.2391304347826087,False,4.66015625,46,45
Haben Sie Alkohol getrunken?,20,3,"aː→ɑː, o→oː, o→oː",0.13043478260869565,False,1.83984375,23,23
Die heutigen Emos waren früher die Grufties.,24,8,"-ɔ, ø→aɪ, aː→ɑː, +r, ɐ→ə, ʁ→r, yː→y, ɐ→ɜ",0.25806451612903225,False,3.1796875,31,31
Nun komm!,5,1,ɔ→a,0.16666666666666666,False,0.759765625,6,6
Mit einfachen Mitteln lässt sich relativ viel erreichen.,32,10,"-a, e→aɪ, -t, ɛ→ə, -l, ɾ→r, e→ɛ, ɑ→a, ɐ→ɾ, ʁ→r",0.23809523809523808,False,4.171875,42,39
"Sobald du drinnen bist, bist du auf dich selbst angewiesen.",34,10,"ː→d, d→uː, ɾ→d, ɪ→ə, n→r, +ɪ, ː→uː, ɪ→iː, +ə, n̩→n",0.23809523809523808,False,3.859375,42,44
Die Alkoholiker in meiner Wohngemeinschaft versuchen mich immer zum Mittrinken zu motivieren.,40,32,"o→oː, +h, o→oː, i→ɪ, ɐ→ə, ɐ→ɜ, o→oː, ŋ→n, -e, m→ɡ, a→ə, -e, n→m, -s, t→aɪ, s→n, h→ʃ, ɛː→ɛ, ɐ→ɾ, ʊ→uː, -ɐ, t→ɜ, s→ts, ʊ→uː, m→ɪ, ɪ→t, ɾ→r, -t, s→ts, o→oː, i→iː, ʁ→r",0.4507042253521127,False,5.7109375,71,67
Notfalls wirf eine Münze.,15,4,"ʁ→ɾ, n→y, t→n, s→ts",0.21052631578947367,False,1.8896484375,19,19
Dahingehend hast du recht.,13,8,"a→ɑː, ə→eː, -h, ɛ→ə, +t, +d, ː→uː, ʁ→r",0.42105263157894735,False,2.01953125,19,20
Der Kühlschrank befindet sich im Zimmer nebenan.,27,9,"eː→ɛ, ɐ→ɾ, yː→uː, ʀ→r, -t, s→ts, ɐ→ɜ, +ə, m̩→n",0.2571428571428571,False,3.279296875,35,35
"Sigrid weiß nicht, womit sie es vergleichen soll.",27,7,"ɪ→iː, ɾ→r, i→iː, o→oː, iː→ɪ, eː→ɛ, ʁ→ɾ",0.20588235294117646,False,3.3203125,34,34
"Sind Smartwatches erlaubt, erkundigt sich Leonie.",27,13,"ʁ→ɾ, ɛ→ɔ, -t, ç→tʃ, ɛː→ɛ, ɐ→ɾ, -a, o→aʊ, -ɛː, ɐ→ɾ, +t, ɛ→eː, ɔ→oː",0.3333333333333333,False,3.400390625,39,37
"Wenn Technik etwas aus der Natur abkupfert, nennt man das Bionik.",37,13,"eː→ɛ, ɐ→ɾ, ɑ→a, ɐ→ɾ, kʰ→k, +p, pf→f, ɐ→ə, +ɾ, -n, b→p, ɪ→iː, ɔ→oː",0.2708333333333333,False,4.4296875,48,49
Verbogene Pfannen kann man auf Gasherden noch benutzen.,37,7,"ɛː→ɛ, ɐ→ɾ, -n, aː→ɑː, ɐ→ɾ, -t, s→ts",0.1590909090909091,False,3.91015625,44,42
Du bist unsere Glücksfee.,14,5,"+d, ː→uː, ɐ→ə, +r, +y",0.3125,False,1.8701171875,16,19
"Ich bin froh, dass ich helfen kann.",19,3,"ʁ→ɾ, +ə, n̩→n",0.14285714285714285,False,2.310546875,21,22
"Die Europäische Union möchte natürlich an den Grenzen auch enge partnerschaftliche Beziehungen, ohne dass jedes Mal die Frage eines EU-Beitritts auf der Tagesordnung steht.",92,39,"ɔ→aɪ, ʁ→r, ɔ→oː, pʰ→p, eː→ɛ, u→ʊ, i→j, œ→ɛ, -., tʰ→t, yː→uː, ʁ→ɾ, ʁ→ɾ, -t, s→ts, e→ə, -ɛ, -ɾ, -s, -t, s→ɜ, h→ʃ, -t, s→ts, aː→ɑː, +ɾ, ʀ→r, aː→ɑː, +eː, ɔ→uː, -ə, ɪ→aɪ, ɾ→r, -t, eː→ɛ, ɐ→ɾ, aː→ɑː, ʁ→ɾ, e→eː",0.3023255813953488,False,10.7421875,129,122
zeichne Audio auf,7,6,"-t, s→ts, -a, e→aɪ, ɪ→iː, ɔ→oː",0.46153846153846156,False,1.6298828125,13,11
Der Affront bringt die Ministerpräsidentin unter Zugzwang.,33,15,"eː→ɛ, ɐ→ɾ, -f, ɔ→oː, -n, -t, ʁ→r, +k, ɪ→i, ɐ→ɜ, ʁ→ɾ, ɪ→i, tʰ→t, +ɜ, ɐ→ɾ",0.32608695652173914,False,4.41015625,46,45
"In diesen Anwendungsbereichen sind primär Rohstoffpreise entscheidend, da Aluminium preisgünstiger als Kupfer ist.",66,28,"i→iː, -ə, s→z, e→ə, ɾ→r, -a, e→aɪ, ɛ→eː, ɾ→r, o→oː, s→ʃ, -f, -a, e→aɪ, +ə, n̩→n, +d, +ɛ, ː→ɾ, u→ʊ, i→j, ɾ→r, -a, e→aɪ, +y, ɐ→ɜ, +ɜ, ɐ→ɾ",0.3146067415730337,False,6.94921875,89,89
Lassen Sie mich das hier noch kurz verstauen!,24,10,"-z, ɐ→ɾ, ʊ→uː, -ʁ, t→ɾ, s→ts, v→f, s→ʃ, -a, o→aʊ",0.29411764705882354,False,2.640625,34,31
Sie gab es auch ganz unverblümt zu.,20,6,"aː→ɑː, eː→ɛ, ɐ→ɾ, yː→y, -t, s→ts",0.23076923076923078,False,3.169921875,26,25
Nehmen wir den Fahrstuhl oder die Treppe?,24,5,"ɐ→ɾ, aː→a, ɐ→ɾ, ɐ→ɜ, -p",0.1724137931034483,False,2.560546875,29,28
"Ich möchte, dass er das Karatetraining besucht.",22,12,"œ→ə, -., tʰ→t, eː→ɛ, ɐ→ɾ, kʰ→k, ʁ→r, a→ɑː, tʰ→t, eː→ə, ʁ→ɾ, ʊ→uː",0.35294117647058826,True,3.2109375,34,33
Was ist so schlimm daran?,14,3,"z→ts, oː→uː, ʁ→r",0.17647058823529413,False,1.3896484375,17,17
Nachhaltiges Wachstum gibt es wahrscheinlich nur bei Pflanzen.,38,11,"a→ɑː, eː→ɛ, ɑ→ɑː, -z, x→ʃ, -ə, ɪ→aɪ, ɐ→ɾ, -p, -t, s→ts",0.22448979591836735,False,4.421875,49,45
Mehr Vorleser werden gesucht.,12,10,"ɐ→ɾ, ɐ→ɾ, ə→eː, s→z, ɐ→ə, eː→ɛ, ɐ→ɾ, +ə, n̩→n, ʊ→uː",0.47619047619047616,False,2.0390625,21,22
"Wenn man schon fürs Training dopen muss, ist es eindeutig zu hart.",35,13,"+yː, ʁ→ɾ, ɔ→oː, pʰ→p, eː→ɛ, -a, e→aɪ, -ɔ, ø→aʊ, -ç, t→k, s→ts, ʁ→ɾ",0.2765957446808511,True,4.5390625,47,45
"Wenn Sie die Türen so zuknallen, können wir morgen gleich wiederkommen.",43,8,"yː→uː, ʁ→r, -t, s→ts, -l, ɐ→ɾ, ʁ→ɾ, ɐ→ɜ",0.1568627450980392,False,4.48828125,51,49
Friede sei mit dir.,10,4,"ɾ→r, -ɛ, ɪ→aɪ, ɐ→ɾ",0.2857142857142857,False,1.259765625,14,13
"Verzeiht, dass ich so laut werde!",17,6,"ɛː→ɛ, ɐ→ɾ, t→ts, s→ts, -a, e→aɪ",0.2608695652173913,False,2.390625,23,22
Am sichersten geht es mit einem Certificate Signing Request.,27,20,"-ɛ, ɾ→ɜ, e→eː, eː→ɛ, -a, e→aɪ, ɐ→z, tʰ→ø, ɪ→ɾ, f→t, cʰ→f, ɛ→ɪ, +k, ɪ→eɪ, -ɪ, ɡ→aɪ, ɪ→ə, ʁ→ɹ, eː→ɪ, v→w",0.43478260869565216,True,4.23828125,46,44
Bleigießen ist nun mal nicht so optimal für die Gesundheit.,39,5,"aː→ɑː, i→iː, aː→ɑː, yː→y, ɐ→ɾ",0.11363636363636363,False,3.859375,44,44
Rick erinnert sich nur noch bruchstückhaft.,23,10,"ʁ→r, ɛː→ɛ, ɐ→ɾ, -n, -ɛ, ɾ→ɜ, ɐ→ɾ, +ɾ, ʁ→r, +y",0.3225806451612903,False,2.759765625,31,31
Die junge Hals-Nasen-Ohren-Ärztin bangt um ihren Arbeitsplatz.,36,12,"aː→ɑː, +ə, ʀ→r, -t, s→ts, ɪ→ə, +k, i→iː, ɾ→r, ʁ→ɾ, -t, s→ts",0.2608695652173913,False,4.48828125,46,46
Für ein Schattentheater braucht es nichts als eine Lichtquelle und die eigenen Hände.,43,18,"yː→uː, -ɐ, ɛ→ɾ, ɪ→aɪ, tʰ→t, tʰ→t, ɛ→eː, aː→ɑː, tʰ→t, ɐ→ɜ, -ʁ, a→ɾ, o→aʊ, eː→ɛ, -t, s→ts, -a, e→aɪ",0.29508196721311475,False,6.37890625,61,57
"Das sieht man daran, dass die Zahl der Beschäftigten steigt, dass die Zahl der Arbeitslosen sinkt, dass mehr junge Menschen in diesem Herbst einen Ausbildungsplatz bekommen werden.",103,32,"+t, a→ɑː, ʁ→r, -t, s→ts, aː→ɑː, eː→ɛ, ɐ→ɾ, -t, s→ts, aː→ɑː, eː→ɛ, ɐ→ɾ, -a, e→aɪ, s→z, +k, ɐ→ɾ, -z, ç→ʃ, i→iː, -ə, s→z, ʁ→ɾ, -a, e→aɪ, -t, s→ts, eː→ɛ, ɐ→ɾ, +ə, n̩→n",0.24242424242424243,False,10.203125,132,128
"Daraus können wir also schlussfolgern, dass Gemüse zu den Dickmachern zählt.",47,11,"a→ɑː, ɾ→r, -a, o→aʊ, ɐ→ɾ, -s, yː→y, -t, s→ts, -t, s→ts",0.1896551724137931,False,5.30859375,58,54
Essen Timer.,5,5,"-z, tʰ→t, ɪ→aɪ, -eː, ɐ→ə",0.5,False,1.330078125,10,8
herunter,6,2,"+ɾ, ɐ→ɜ",0.2857142857142857,False,0.64990234375,7,8
Der Angriff war ein Befehl!,13,8,"eː→ɛ, ɐ→ɾ, -f, -aː, ɐ→ɑː, ɛ→ɾ, ɪ→aɪ, e→eː",0.38095238095238093,False,1.7197265625,21,19
"Man findet Schildkröten, seltener den Weißspitzen-Hochseehai, Weißspitzen-Riffhai, Grauen Riffhai und Manta.",58,22,"ʀ→ɾ, øː→yː, +ə, n̩→n, -ɐ, s→ʃ, -t, s→ts, s→ʃ, -t, s→ts, ʁ→r, -h, ɾ→r, -a, -o, ə→aʊ, n→l, ʁ→r, -h, tʰ→t, a→ɑː",0.27848101265822783,False,8.65625,79,73
Manche Probanden haben sich aus Langeweile freiwillig schmerzhafte Stromschläge verpasst.,53,21,"x→ç, ʁ→ɾ, ɔ→oː, aː→ɑː, e→ə, -ə, iː→aɪ, ɾ→r, -a, e→aɪ, -l, ç→ɡ, -t, s→ts, ɔ→oː, -s, -t, s→ʃ, ɛː→ɛ, ɐ→ɾ, -s",0.28378378378378377,False,6.21875,74,67
Hier werden zwei verschiedene Dinge in einen Topf geworfen.,34,10,"ɐ→ɾ, eː→ɛ, ɐ→ɾ, n̩→ə, t→n, s→ts, ɛː→ɛ, ɐ→ɾ, -a, e→aɪ",0.22727272727272727,False,4.21875,44,43
verschneit,3,5,"ɛː→ɛ, ɐ→ɾ, -ə, iː→aɪ, t→d",0.625,False,0.72021484375,8,7
Nach dem Aufprall könnte die ein oder andere Rippe gebrochen sein.,36,13,"aː→ɑː, -a, o→aʊ, ɾ→r, -l, œ→ə, -ɛ, ɪ→aɪ, ɐ→ɜ, ʀ→r, ɾ→r, -p, ʁ→r",0.2653061224489796,False,4.26171875,49,45
Angesichts des chemischen Geruchs würde ich eher auf Plastik tippen.,41,9,"s→ts, ə→ɛ, ç→ʃ, ʁ→r, +y, -ə, ʁ→ɜ, i→ɪ, -p",0.1836734693877551,False,4.578125,49,48
"Alle meine Freunde sagen, ich sei verrückt, doch ich ziehe das durch.",35,12,"-ɔ, ø→aʊ, aː→ɑː, -ɛ, ɪ→aɪ, ɐ→ɾ, ʁ→r, +y, -t, s→ts, ʊ→oː, ʁ→ɾ",0.2608695652173913,False,4.55078125,46,44
Distelblau,8,1,-d,0.1111111111111111,False,0.83984375,9,8
Mich hat die Sehnsucht gepackt und deshalb bin ich spontan vorbeigekommen.,49,9,"+h, +ç, a→ɑː, oː→ɔ, ɐ→ɾ, -ə, iː→aɪ, e→ə, -m",0.16071428571428573,False,4.640625,56,56
"Alle Kinder, eheliche wie außereheliche, genießen den gleichen sozialen Schutz.",43,13,"ɐ→ɜ, -ə, -ç, eː→ɜ, ʁ→ɾ, +ə, o→ʊ, t→ts, s→j, -i, a→ɑː, -t, s→ts",0.23636363636363636,False,5.578125,55,52
"Um mit anderen zu zocken, braucht man heutzutage nicht einmal mehr grundlegende Netzwerkkenntnisse.",57,23,"ɐ→ə, +r, -t, s→ts, kʰ→k, ʁ→r, -a, o→aʊ, -ɔ, -., t→aʊ, s→ts, u→uː, aː→ɑː, -a, e→aɪ, a→ɑː, ɐ→ɾ, +r, ɛ→ə, +ɾ, ʁ→k, cʰ→k",0.2987012987012987,False,6.8203125,77,75
"Weil die Luft irgendwo hin muss, weicht sie nach Norden und Süden aus.",41,8,"ʁ→ɾ, v→s, a→v, e→aɪ, aː→a, ʁ→ɾ, +ə, yː→uː",0.16666666666666666,False,4.71875,48,49
Denn wir sind effizient und haben keinen Humor.,28,10,"ɐ→ɾ, ɛ→eː, -f, i→iː, -t, s→ts, i→iː, aː→ɑː, uː→u, o→ɔ",0.2631578947368421,False,3.01953125,38,36
Da braut sich was zusammen.,13,8,"+d, ː→ɑː, ʁ→r, -a, o→aʊ, -t, s→ts, u→uː",0.4,False,1.8896484375,20,19
Passen Sie doch auf!,12,0,,0.0,False,1.1298828125,12,12
Gefällt dir die Farbe rot?,16,3,"ɐ→ɾ, ʁ→ɾ, ɾ→r",0.15789473684210525,False,1.6904296875,19,19
Nur für dich habe ich schon mal den Sitz vorgeheizt.,27,11,"ɐ→ɾ, yː→y, ɐ→ɾ, aː→ɑː, aː→ɑː, -t, s→ts, ɐ→ɾ, aj→aɪ, -s, t→ts",0.2894736842105263,False,3.23046875,38,36
Das ist eine Eins-plus mit Sternchen.,24,4,"-a, e→aɪ, s→ts, uː→ʊ",0.14285714285714285,False,3.259765625,28,27
Jetzt dürfte es auch dem Letzten unklar sein.,29,5,"t→ts, +y, eː→ɛ, a→ɑː, ɽ→ɾ",0.15151515151515152,False,3.189453125,33,34
Ich krieg noch immer jedes Jahr einen selbstgemachten Adventkalender von meinem Vater.,52,12,"ʁ→ɾ, +t, ɐ→ɜ, -aː, a→ɑː, e→aɪ, a→ɑː, tʰ→t, kʰ→k, ɐ→ɜ, aː→ɑː, ɐ→ɜ",0.19047619047619047,False,5.8203125,63,63
"Der Radius der Kugel bestimmt, wie klein man mit einem Kugelschreiber schreiben kann.",44,20,"eː→ɛ, ɐ→ɾ, ʁ→r, a→ɑː, t→d, j→iː, eː→ɛ, ɐ→ɾ, -m, -a, e→aɪ, ɛ→ə, s→ʃ, -t, s→r, -ɾ, -a, e→aɪ, ɐ→ɜ, ʁ→r",0.3125,False,5.62890625,64,59
Zählt man als Datenbänker auch zu den Bänkern?,26,11,"-t, s→ts, +t, aː→ɑː, tʰ→t, kʰ→k, ɐ→ə, -t, s→ts, ɛ→ə, -ɾ",0.3055555555555556,False,3.439453125,36,34
"Na, das wäre doch ein adäquater Ansatz.",18,11,"aː→ɑː, ɛː→eː, ʀ→r, -ɛ, ɪ→aɪ, ɛ→ɪ, aː→ɑː, tʰ→t, ɐ→ɜ, -t, s→ts",0.3793103448275862,False,2.689453125,29,27
Packt also nur das Nötigste in euren Rucksack.,28,7,"ɐ→ɾ, øː→ø, ɡ→k, -ə, uː→aʊ, ɐ→r, ʀ→r",0.2,False,2.94921875,35,34
Aber daraus lässt sich keine Schuld ableiten.,23,10,"ɑː→a, -e, ɾ→ɜ, a→ɑː, ɾ→r, -a, o→aʊ, ʊ→u, -ə, iː→aɪ",0.30303030303030304,False,3.330078125,33,30
Von morgens früh bis abends spät sitze ich am Empfangsgerät.,35,12,"ɛ→ə, yː→uː, a→ɑː, p→b, ɛ→ə, -s, ɛː→ɛ, -t, s→ts, -p, e→ə, ɾ→r",0.2553191489361702,False,4.51171875,47,44
Helles Orange,6,4,"-l, ə→ɪ, ː→ɑ̃, ʃ→ʒ",0.4,False,1.33984375,10,9
"Hat mir jedenfalls irgendein Typ erzählt, den ich auf einer Party kennengelernt habe.",49,18,"+ə, æ→ɾ, ʁ→ɾ, +ə, n̩→n, yː→uː, -ɛː, ɐ→ɛ, t→ɾ, s→ts, -a, e→aɪ, ɛː→ɜ, ɐ→ɾ, j→iː, cʰ→k, ʁ→ɾ, aː→ɑː",0.27692307692307694,True,5.48046875,65,65
Der Ball verfehlte das Tor um wenige Zentimeter.,27,11,"eː→ɛ, ɐ→ɾ, ɛː→ɛ, ɐ→ɾ, e→eː, ɐ→ɾ, -t, s→ts, i→iː, ə→eː, ɐ→ɜ",0.2894736842105263,False,4.078125,38,37
Muss ich jetzt sterben?,14,3,"ʊ→u, t→ts, ʁ→ɾ",0.17647058823529413,False,1.759765625,17,17
Der Ball treibt ab und der Junge schwimmt hinterher.,25,13,"eː→ɛ, ɐ→ɾ, ɾ→r, -a, e→aɪ, eː→ɛ, ɐ→ɾ, -ʊ, -m, ɛ→ɜ, ɾ→h, ɐ→eː, +ɾ",0.35135135135135137,False,4.23046875,37,35
Netzwerke,7,2,"-t, s→ts",0.2222222222222222,False,0.85986328125,9,8
Konnte der Protagonist sein Computerproblem lösen?,36,6,"eː→ɛ, ɐ→ɾ, -ʀ, o→oː, o→oː, øː→ø",0.14285714285714285,False,3.41015625,42,41
Welche Skills kann ich installieren?,22,4,"-., c→ɡ, s→ts, ʁ→r",0.15384615384615385,False,2.2890625,26,25
Am sechsten Tage wurden die Brüder zu den Waffen gerufen.,33,11,"ç→k, aː→ɑː, ʊ→uː, ʀ→r, yː→uː, -ɐ, t→ɜ, s→ts, +ə, ̩→n, ɾ→r",0.2558139534883721,False,3.869140625,43,43
Meinst du einen Soziopathen?,13,10,"-a, e→aɪ, t→d, -ː, a→uː, e→aɪ, -t, s→ts, ɪ→iː, ɑ→a",0.43478260869565216,False,1.8798828125,23,20
Andernfalls würde man Keimen und Schädlingen Tür und Tor öffnen.,40,7,"ɐ→ɜ, +y, ɛː→ɛ, yː→uː, ɐ→ɾ, ɐ→ɾ, œ→ə",0.15217391304347827,False,4.87109375,46,47
Solarmodule leiden unter Hitze.,16,10,"ɔ→o, aː→a, -ɐ, oː→o, +ə, n̩→n, +ɜ, ɐ→ɾ, -t, s→ts",0.4166666666666667,False,2.76953125,24,24
Einfach mit einer Schere ausschneiden und dann in dieses Heftchen kleben.,40,13,"-a, e→aɪ, ɛː→ɜ, ɐ→ɾ, ɐ→eː, ə→r, a→ə, o→aʊ, -a, e→aɪ, i→iː, -ə, s→z",0.24528301886792453,False,5.109375,53,50
Herrn Arndt hat er den Laufpass gegeben.,21,11,"eː→ɛ, -ɐ, aː→a, ɐ→ɾ, eː→ɛ, ɐ→ɾ, -a, o→aʊ, -s, +ə, m̩→n",0.3548387096774194,False,2.529296875,31,29
Die Tasche kriegen wir locker noch in den Kofferraum.,28,9,"ʁ→r, ɐ→ɾ, ɐ→ə, -f, -ɛ, ɾ→ɜ, ɾ→r, -a, o→aʊ",0.24324324324324326,False,3.810546875,37,34
Erhöhe die Helligkeit,12,4,"+ɛ, ɛː→ɾ, ɐ→ɾ, øː→ø",0.26666666666666666,False,1.490234375,15,16
Es kamen sogar Gäste von der grünen Hochzeitsfeier.,27,12,"eː→ɛ, o→oː, a→ɑː, ɽ→ɾ, eː→ɛ, ɐ→ɾ, ɾ→r, yː→uː, -aj, t→aɪ, aj→aɪ, ɐ→ɜ",0.3076923076923077,False,3.6796875,39,38
Wegen schweren Unwetters musste der Fährbetrieb eingestellt werden.,38,15,"ʀ→r, -ɛ, ɾ→ɜ, eː→ɛ, ɐ→ɾ, eː→ɛ, ɐ→ɾ, ʁ→ɾ, -a, e→aɪ, -l, eː→ɛ, ɐ→ɾ, +ə, n̩→n",0.28846153846153844,False,4.44921875,52,50
So steht Afghanistan immer auf Platz eins.,19,12,"e→eː, a→aʊ, +ɡ, k→ɑː, a→ɾ, a→ɑː, ɐ→ɜ, -t, s→ts, -a, e→aɪ, -s",0.4,False,3.08984375,30,28
"Kommt, wir schießen auf ein Pulverfass!",22,5,"ɐ→ɾ, -ɛ, ɪ→aɪ, ɛ→ɜ, -s",0.18518518518518517,False,2.16015625,27,25
Komplett in Großbuchstaben verfasste Abschnitte sind eine Zumutung für den Leser.,51,14,"-k, +ə, ɾ→r, oː→uː, -x, ɛː→ɛ, ɐ→ɾ, -z, -t, s→ts, ɐ→ɾ, ə→eː, s→z, ɐ→ɜ",0.21875,False,4.53125,64,61
"Und deshalb haben wir uns im vergangenen Jahr schon mit dem Thema „Innovation“ und auch mit Fragen der Lebensqualität beschäftigt und uns informiert, wie andere damit umgehen.",109,24,"+h, aː→ɑː, ɐ→ɾ, ɛː→ɛ, ɐ→ɾ, +ɑː, aː→ɾ, -d, a→ɑː, -n, o→oː, ɑ→a, t→ts, s→j, ʁ→ɾ, aː→ɑː, eː→ɛ, ɐ→ɾ, eː→iː, ɪ→iː, tʰ→t, eː→ɛ, ʀ→r, a→ɑː",0.183206106870229,False,11.140625,131,131
Dem Baby verabreicht man Fiebermittel als Zäpfchen.,26,16,"m→n, ɑː→eː, b→l, j→b, +iː, ɛː→ɛ, ɐ→ɾ, ɾ→r, -a, e→aɪ, -ɛ, ɾ→ɜ, e→ə, -l, -t, s→ts",0.3902439024390244,True,3.900390625,41,38
"Ja, das glaube ich, denn wir wissen seit Bestehen der Bundesrepublik, dass eine gute deutsch-französische Beziehung einfach ganz wichtig ist für beide Länder.",90,25,"+j, ː→ɑː, -a, o→aʊ, ɐ→ɾ, +ə, n̩→n, eː→ɛ, ɐ→ɾ, ʀ→r, e→eː, u→uː, e→ə, ɔ→aʊ, ø→tʃ, tʃ→ʃ, -t, s→ts, -t, s→ts, +k, ç→k, ɐ→ɾ, -., ɐ→ɜ",0.22321428571428573,False,10.3125,112,111
Auf der Karte sah der Weg ganz einfach aus.,21,9,"eː→ɛ, ɐ→ɾ, ʁ→ɾ, aː→ɑː, eː→ɛ, +ɾ, ɐ→ɾ, ɛ→eː, s→ts",0.3103448275862069,False,3.140625,29,30
Der Mittelpunkt von Nordrhein-Westfalen befindet sich in Lipperbruch.,45,10,"eː→ɛ, ɐ→ɾ, +ə, l̩→l, -k, +n, ɾ→r, -ə, ɪ→aɪ, a→ɑː",0.18867924528301888,False,4.05078125,53,53
Freddie machte sich auf den Heimweg.,21,4,"ʁ→r, -a, e→aɪ, e→eː",0.16,False,2.2109375,25,24
"Aber ich glaube, wir haben den Ländern für Integration auch sehr viele Mittel bereitgestellt, selber auch sehr viele Initiativen ergriffen.",74,33,"-e, ɾ→ɜ, -a, o→aʊ, ɐ→ɾ, aː→ɑː, -ɛ, ɾ→ɜ, ɐ→ɾ, ɛ→eː, ɑ→a, t→ts, s→j, e→eː, v→f, -t, eː→ə, ɾ→r, -a, e→aɪ, ɛ→ə, s→ʃ, -l, ɐ→ɜ, e→eː, v→f, ɪ→iː, ɪ→j, aː→a, tʰ→t, ɛː→ɛ, ɐ→ɾ, -f",0.308411214953271,False,8.8984375,107,100
"Verflucht, der Computer hat recht!",18,8,"ɛː→ɛ, ɐ→ɾ, ʊ→uː, eː→ɛ, ɐ→ɾ, ɐ→ɜ, ʁ→r, -t",0.3076923076923077,True,1.990234375,26,25
Eure Schoko-Bonbons sind sagenhaft lecker!,22,10,"-ɔ, ø→aɪ, ɾ→r, e→ə, ɔ→oː, kʰ→k, ɔ→oː, n→m, n→ŋ, ɐ→ɜ",0.3125,False,2.58984375,32,31
Mein Psychologe will unbedingt einen Horrorfilm mit mir anschauen.,40,10,"s→z, j→y, o→oː, -a, e→aɪ, -ɾ, ɾ→r, -ɔ, ɾ→ɑː, æ→ɾ",0.2,False,4.1015625,50,47
Stell dich nicht über andere.,17,4,"l→ə, yː→uː, ɐ→ɜ, ʀ→r",0.19047619047619047,False,1.740234375,21,21
Ehrlich gesagt finde ich den Laden zu schickimicki gestaltet.,34,11,"eː→ɛ, ɐ→ɾ, aː→ɑː, aː→ɑː, n̩→ə, t→n, s→ts, cʰ→k, ɪ→iː, cʰ→k, ɪ→iː",0.24444444444444444,False,4.51953125,45,45
in Zwischenablage schneiden,14,7,"-t, s→ts, e→ə, b→p, ɑ→ɑː, +ə, n̩→n",0.35,False,2.0,20,20
"Urplötzlich wurde dem Privatdetektiv klar, worum es dem Dieb eigentlich ging.",42,19,"ʊ→uː, ɾ→ə, œ→ə, -t, ʊ→uː, -ɾ, ʁ→ɾ, ɪ→i, aː→a, ɛ→eː, tʰ→t, aː→ɑː, ɐ→ɾ, ɾ→r, u→ʊ, eː→ɛ, -ə, ɪ→aɪ, ɛ→ə",0.3114754098360656,True,5.0390625,61,58
Jerry hat den Sekt zu schnell getrunken und nun ist ihm schwindelig.,43,7,"j→dʒ, ʁ→r, ɪ→iː, -t, s→ts, e→ə, ç→k",0.14,False,4.578125,50,49
Kindererziehungszeiten werden grundsätzlich auch in den bei einer Ehescheidung vom Familiengericht durchgeführten Versorgungsausgleich einbezogen.,78,39,"-eː, ʁ→ɜ, ɜ→ɛ, t→ɾ, s→ts, -t, s→ts, eː→ɛ, ɐ→ɾ, +ə, n̩→n, ɾ→r, -t, s→ts, n→m, -a, e→aɪ, -ɛː, ɐ→ɜ, eː→iː, -ɛ, -a, e→aɪ, +k, v→f, oː→ɔ, ɪ→j, ʁ→r, ʊ→oː, -ɾ, -t, s→ç, e→ə, j→y, -a, e→aɪ, b→ɡ, -t, s→ts",0.3391304347826087,False,9.2578125,115,106
Nun bin ich endlich fertig.,17,3,"ʁ→ɾ, i→ɪ, ɡ→k",0.15,False,1.6298828125,20,20
Es kommt noch dicker!,11,2,"eː→ɛ, ɐ→ɜ",0.15384615384615385,False,1.169921875,13,13
